<?xml version="1.0"?>
<!-- This file is used for xml files which install, update or delete event listeners. -->
<xs:schema xmlns:xs="http://www.w3.org/2001/XMLSchema" xmlns="http://www.woltlab.com" targetNamespace="http://www.woltlab.com" elementFormDefault="qualified">
	<!-- include types -->
	<xs:include schemaLocation="types.xsd" />
	
	<!-- data node -->
	<xs:element name="data">
		<xs:complexType>
			<xs:all>
				<xs:element name="import" type="import" minOccurs="0" />
				<xs:element name="delete" type="delete" minOccurs="0" />
			</xs:all>
		</xs:complexType>
	</xs:element>
	
	<!-- import element type -->
	<xs:complexType name="import">
		<xs:sequence>
			<xs:element name="event" type="event" maxOccurs="unbounded" />
		</xs:sequence>
	</xs:complexType>
	
	<!-- delete element type -->
	<xs:complexType name="delete">
		<xs:sequence>
			<xs:element name="event" type="event" maxOccurs="unbounded" />
		</xs:sequence>
	</xs:complexType>
	
	<!-- event listener element type -->
	<xs:complexType name="event">
		<xs:all>
			<xs:element name="classname" minOccurs="0">
				<xs:simpleType>
					<xs:restriction base="xs:string">
						<xs:minLength value="0" />
						<xs:maxLength value="255" />
					</xs:restriction>
				</xs:simpleType>
			</xs:element>
			<xs:element name="name" minOccurs="0">
				<xs:simpleType>
					<xs:restriction base="xs:string">
						<xs:minLength value="0" />
						<xs:maxLength value="255" />
					</xs:restriction>
				</xs:simpleType>
			</xs:element>
			<xs:element name="objecttype" type="xs:string" minOccurs="0" />
			<xs:element name="options" type="xs:string" minOccurs="0" />
			<xs:element name="permissions" type="xs:string" minOccurs="0" />
			<xs:element name="preset" type="woltlab_boolean" minOccurs="0" />
		</xs:all>
	</xs:complexType>
</xs:schema>