<?xml version="1.0" encoding="UTF-8"?>
<data xmlns="http://www.woltlab.com" xmlns:xsi="http://www.w3.org/2001/XMLSchema-instance" xsi:schemaLocation="http://www.woltlab.com http://www.woltlab.com/XSD/maelstrom/userNotificationEvent.xsd">
	<import>
		<event>
			<name>following</name>
			<objecttype>com.woltlab.wcf.user.follow</objecttype>
			<classname><![CDATA[wcf\system\user\notification\event\UserFollowFollowingUserNotificationEvent]]></classname>
		</event>
		
		<event>
			<name>comment</name>
			<objecttype>com.woltlab.wcf.user.profileComment.notification</objecttype>
			<classname><![CDATA[wcf\system\user\notification\event\UserProfileCommentUserNotificationEvent]]></classname>
			<preset>1</preset>
			<options>module_user_profile_wall</options>
		</event>
		<event>
			<name>commentResponse</name>
			<objecttype>com.woltlab.wcf.user.profileComment.response.notification</objecttype>
			<classname><![CDATA[wcf\system\user\notification\event\UserProfileCommentResponseUserNotificationEvent]]></classname>
			<preset>1</preset>
			<options>module_user_profile_wall</options>
		</event>
		<event>
			<name>commentResponseOwner</name>
			<objecttype>com.woltlab.wcf.user.profileComment.response.notification</objecttype>
			<classname><![CDATA[wcf\system\user\notification\event\UserProfileCommentResponseOwnerUserNotificationEvent]]></classname>
			<preset>1</preset>
			<options>module_user_profile_wall</options>
		</event>
		
		<event>
			<name>like</name>
			<objecttype>com.woltlab.wcf.user.profileComment.like.notification</objecttype>
			<classname><![CDATA[wcf\system\user\notification\event\UserProfileCommentLikeUserNotificationEvent]]></classname>
			<preset>1</preset>
			<options>module_like</options>
		</event>
		<event>
			<name>like</name>
			<objecttype>com.woltlab.wcf.user.profileComment.response.like.notification</objecttype>
			<classname><![CDATA[wcf\system\user\notification\event\UserProfileCommentResponseLikeUserNotificationEvent]]></classname>
			<preset>1</preset>
			<options>module_like</options>
		</event>
		
		<event>
			<name>comment</name>
			<objecttype>com.woltlab.wcf.moderation.queue.notification</objecttype>
			<classname><![CDATA[wcf\system\user\notification\event\ModerationQueueCommentUserNotificationEvent]]></classname>
			<preset>1</preset>
			<permissions>mod.general.canUseModeration</permissions>
		</event>
		<event>
			<name>commentResponse</name>
			<objecttype>com.woltlab.wcf.moderation.queue.response.notification</objecttype>
			<classname><![CDATA[wcf\system\user\notification\event\ModerationQueueCommentResponseUserNotificationEvent]]></classname>
			<preset>1</preset>
			<permissions>mod.general.canUseModeration</permissions>
		</event>
	</import>
</data>
